[
  {
    "question_id": "biology_2019_q103",
    "subject": "biology",
    "year": 2019,
    "question_number": 103,
    "stem": "Ví dụ nào sau đây minh họa cho cơ quan tương đồng?",
    "choices": {
      "A": "Cánh dơi và cánh côn trùng.",
      "B": "Gai xương rồng và tua cuốn của đậu Hà Lan.",
      "C": "Mang cá và mang tôm.",
      "D": "Chân chuột chũi và chân dế mủi."
    },
    "answer": "C",
    "is_usable": true,
    "exclusion_tag": null,
    "difficulty": "medium",
    "metadata": {
      "stem_char_length": 50,
      "stem_line_count": 1
    }
  },
  {
    "question_id": "biology_2019_q104",
    "subject": "biology",
    "year": 2019,
    "question_number": 104,
    "stem": "Theo thuyết tiến hóa hiện đại, quá trình hình thành loài mới bằng con đường cách li địa lí",
    "choices": {
      "A": "thường diễn ra một cách chậm chạp qua nhiều giai đoạn trung gian chuyển tiếp.",
      "B": "chỉ diễn ra ở các loài động vật có khả năng phát tán mạnh.",
      "C": "không có sự tham gia của các nhân tố biến động di truyền.",
      "D": "luôn có sự tham gia của quá trình hình thành đặc điểm thích nghi."
    },
    "answer": "A",
    "is_usable": true,
    "exclusion_tag": null,
    "difficulty": "medium",
    "metadata": {
      "stem_char_length": 90,
      "stem_line_count": 1
    }
  },
  {
    "question_id": "biology_2019_q108",
    "subject": "biology",
    "year": 2019,
    "question_number": 108,
    "stem": "Một loài thực vật, tiến hành phép lai P: AAbb x aaBB, thu được các hợp tử lưỡng bội. Xử lí các hợp tử này bằng cônsixin để tạo các hợp tử tứ bội. Biết rằng hiệu quả gây tứ bội là 36%; các hợp tử đều phát triển thành các cây F1; các cây F1 đều giảm phân tạo giao tử, các cây tứ bội chỉ tạo giao tử lưỡng bội. Theo lí thuyết, giao tử có 2 alen trội của F1 chiếm tỉ lệ",
    "choices": {
      "A": "32%.",
      "B": "34%.",
      "C": "22%.",
      "D": "40%."
    },
    "answer": "B",
    "is_usable": true,
    "exclusion_tag": null,
    "difficulty": "medium",
    "metadata": {
      "stem_char_length": 365,
      "stem_line_count": 1
    }
  },
  {
    "question_id": "biology_2019_q113",
    "subject": "biology",
    "year": 2019,
    "question_number": 113,
    "stem": "Một quần thể ngẫu phối, nghiên cứu 1 gen nằm trên NST thường có 3 alen là A1, A2 và A3. Ở thế hệ P, quần thể đạt trạng thái cân bằng di truyền có các kiểu gen A1A2, A1A3 và A2A3 với tần số bằng nhau. Biết rằng quần thể không chịu tác động của các nhân tố tiến hóa. Cho các phát biểu sau:\nI. Tổng tần số các loại kiểu gen dị hợp luôn gấp đôi tổng tần số các loại kiểu gen đồng hợp.\nII. Thế hệ P có tỉ lệ các loại kiểu gen là 1 : 1 : 2 : 1 : 1 : 2.\nIII. Nếu alen A1 trội hoàn toàn so với alen A2 và alen A3 thì kiểu hình do alen A1 quy định luôn chiếm tỉ lệ lớn nhất.\nIV. Nếu tất cả các cá thể có kiểu gen đồng hợp không có khả năng sinh sản thì thành phần kiểu gen của quần thể ở F1 không thay đổi so với thế hệ P.\nTheo lí thuyết, trong các phát biểu trên, có bao nhiêu phát biểu đúng?",
    "choices": {
      "A": "1.",
      "B": "4.",
      "C": "3.",
      "D": "2."
    },
    "answer": "B",
    "is_usable": true,
    "exclusion_tag": null,
    "difficulty": "hard",
    "metadata": {
      "stem_char_length": 784,
      "stem_line_count": 6
    }
  },
  {
    "question_id": "biology_2019_q117",
    "subject": "biology",
    "year": 2019,
    "question_number": 117,
    "stem": "Ở ruồi giấm, alen A quy định thân xám trội hoàn toàn so với alen a quy định thân đen; alen B quy định cánh dài trội hoàn toàn so với alen b quy định cánh cụt; alen D quy định mắt đỏ trội hoàn toàn so với alen d quy định mắt trắng. Phép lai P: AB/ab X^D X^d x AB/ab X^D Y, thu được F1. Ở F1 có tổng số ruồi thân xám, cánh dài, mắt đỏ và ruồi thân xám, cánh cụt, mắt trắng chiếm 53,75%. Theo lí thuyết, trong tổng số ruồi cái thân xám, cánh dài, mắt đỏ ở F1, số ruồi đồng hợp 3 cặp gen chiếm tỉ lệ bao nhiêu?",
    "choices": {
      "A": "7/40.",
      "B": "21/40.",
      "C": "1/7.",
      "D": "7/20."
    },
    "answer": "C",
    "is_usable": true,
    "exclusion_tag": null,
    "difficulty": "hard",
    "metadata": {
      "stem_char_length": 506,
      "stem_line_count": 1
    }
  },
  {
    "question_id": "biology_2019_q119",
    "subject": "biology",
    "year": 2019,
    "question_number": 119,
    "stem": "Cho cây hoa đỏ (P) có kiểu gen AaBbDd tự thụ phấn, thu được F1 có tỉ lệ 27 cây hoa đỏ : 37 cây hoa trắng. Theo lí thuyết, trong tổng số cây F1, số cây hoa trắng đồng hợp 2 cặp gen chiếm tỉ lệ",
    "choices": {
      "A": "3/16.",
      "B": "12/37.",
      "C": "9/32.",
      "D": "18/37."
    },
    "answer": "C",
    "is_usable": true,
    "exclusion_tag": null,
    "difficulty": "hard",
    "metadata": {
      "stem_char_length": 191,
      "stem_line_count": 1
    }
  },
  {
    "question_id": "biology_2019_q81",
    "subject": "biology",
    "year": 2019,
    "question_number": 81,
    "stem": "Cà độc dược có bộ NST 2n = 24. Theo lí thuyết, số nhóm gen liên kết của loài này là",
    "choices": {
      "A": "8.",
      "B": "12.",
      "C": "16.",
      "D": "24."
    },
    "answer": "B",
    "is_usable": true,
    "exclusion_tag": null,
    "difficulty": "easy",
    "metadata": {
      "stem_char_length": 83,
      "stem_line_count": 1
    }
  },
  {
    "question_id": "biology_2019_q86",
    "subject": "biology",
    "year": 2019,
    "question_number": 86,
    "stem": "Trong ống tiêu hóa của người, quá trình tiêu hóa hóa học diễn ra chủ yếu ở",
    "choices": {
      "A": "ruột non.",
      "B": "thực quản.",
      "C": "dạ dày.",
      "D": "ruột già."
    },
    "answer": "A",
    "is_usable": true,
    "exclusion_tag": null,
    "difficulty": "easy",
    "metadata": {
      "stem_char_length": 74,
      "stem_line_count": 1
    }
  },
  {
    "question_id": "biology_2019_q87",
    "subject": "biology",
    "year": 2019,
    "question_number": 87,
    "stem": "Từ 1 cây có kiểu gen AABBdd, bằng phương pháp nuôi cấy hạt phấn trong ống nghiệm có thể tạo ra tối đa bao nhiêu dòng cây đơn bội có kiểu gen khác nhau?",
    "choices": {
      "A": "4.",
      "B": "3.",
      "C": "2.",
      "D": "1."
    },
    "answer": "C",
    "is_usable": true,
    "exclusion_tag": null,
    "difficulty": "easy",
    "metadata": {
      "stem_char_length": 151,
      "stem_line_count": 1
    }
  },
  {
    "question_id": "biology_2019_q89",
    "subject": "biology",
    "year": 2019,
    "question_number": 89,
    "stem": "Một đoạn NST bị đứt ra, đảo ngược 180^o và nối lại vị trí cũ làm phát sinh đột biến",
    "choices": {
      "A": "mất đoạn.",
      "B": "lặp đoạn.",
      "C": "chuyển đoạn.",
      "D": "đảo đoạn."
    },
    "answer": "D",
    "is_usable": true,
    "exclusion_tag": null,
    "difficulty": "easy",
    "metadata": {
      "stem_char_length": 83,
      "stem_line_count": 1
    }
  },
  {
    "question_id": "biology_2019_q90",
    "subject": "biology",
    "year": 2019,
    "question_number": 90,
    "stem": "Cơ thể sinh vật có bộ NST gồm 2 bộ NST lưỡng bội của 2 loài khác nhau được gọi là",
    "choices": {
      "A": "thể tam bội.",
      "B": "thể ba.",
      "C": "thể một.",
      "D": "thể dị đa bội."
    },
    "answer": "D",
    "is_usable": true,
    "exclusion_tag": null,
    "difficulty": "easy",
    "metadata": {
      "stem_char_length": 81,
      "stem_line_count": 1
    }
  },
  {
    "question_id": "biology_2019_q92",
    "subject": "biology",
    "year": 2019,
    "question_number": 92,
    "stem": "Trong lịch sử phát triển của sinh giới qua các đại địa chất, chim phát sinh ở",
    "choices": {
      "A": "đại Nguyên sinh.",
      "B": "đại Trung sinh.",
      "C": "đại Tân sinh.",
      "D": "đại Thái cổ."
    },
    "answer": "B",
    "is_usable": true,
    "exclusion_tag": null,
    "difficulty": "easy",
    "metadata": {
      "stem_char_length": 77,
      "stem_line_count": 1
    }
  },
  {
    "question_id": "biology_2019_q94",
    "subject": "biology",
    "year": 2019,
    "question_number": 94,
    "stem": "Theo lí thuyết, phép lai nào sau đây cho đời con chỉ có kiểu gen đồng hợp?",
    "choices": {
      "A": "aa x aa.",
      "B": "AA x aa.",
      "C": "Aa x Aa.",
      "D": "AA x Aa."
    },
    "answer": "A",
    "is_usable": true,
    "exclusion_tag": null,
    "difficulty": "easy",
    "metadata": {
      "stem_char_length": 74,
      "stem_line_count": 1
    }
  },
  {
    "question_id": "biology_2020_q102",
    "subject": "biology",
    "year": 2020,
    "question_number": 102,
    "stem": "Một loài thực vật, xét 2 cặp gen phân li độc lập, alen A quy định thân cao trội hoàn toàn so với alen a quy định thân thấp; alen B quy định hoa đỏ trội hoàn toàn so với alen b quy định hoa trắng. Phép lai P: Cây thân cao, hoa đỏ x Cây thân cao, hoa đỏ, thu được F1. Theo lí thuyết, nếu F1 xuất hiện kiểu hình thân cao, hoa đỏ thì tỉ lệ kiểu hình này có thể là",
    "choices": {
      "A": "18,75%.",
      "B": "12,50%.",
      "C": "75,00%.",
      "D": "6,25%."
    },
    "answer": "C",
    "is_usable": true,
    "exclusion_tag": null,
    "difficulty": "medium",
    "metadata": {
      "stem_char_length": 359,
      "stem_line_count": 1
    }
  },
  {
    "question_id": "biology_2020_q104",
    "subject": "biology",
    "year": 2020,
    "question_number": 104,
    "stem": "Một bệnh nhân bị bệnh tim được lắp máy trợ tim có chức năng phát xung điện cho tim. Máy trợ tim này có chức năng tương tự cấu trúc nào trong hệ dẫn truyền tim?",
    "choices": {
      "A": "Nút xoang nhĩ.",
      "B": "Bó His.",
      "C": "Mạng Puôckin.",
      "D": "Nút nhĩ thất."
    },
    "answer": "A",
    "is_usable": true,
    "exclusion_tag": null,
    "difficulty": "medium",
    "metadata": {
      "stem_char_length": 159,
      "stem_line_count": 1
    }
  },
  {
    "question_id": "biology_2020_q109",
    "subject": "biology",
    "year": 2020,
    "question_number": 109,